<?xml version="1.0" encoding="UTF-8"?>
<vcs-root xmlns:xsi="http://www.w3.org/2001/XMLSchema-instance" uuid="03a4ac21-8dc7-4ec2-b4ad-5d74046c8379" type="jetbrains.git" xsi:noNamespaceSchemaLocation="https://www.jetbrains.com/teamcity/schemas/2020.1/project-config.xsd">
  <name>BarBaz</name>
  <param name="agentCleanFilesPolicy" value="ALL_UNTRACKED" />
  <param name="agentCleanPolicy" value="ON_BRANCH_CHANGE" />
  <param name="authMethod" value="PRIVATE_KEY_FILE" />
  <param name="branch" value="master" />
  <param name="ignoreKnownHosts" value="true" />
  <param name="privateKeyPath" value="/foo/bar/baz.pem" />
  <param name="secure:passphrase" value="zxx2b4d581dd842317df16da29ef3ff4cf0" />
  <param name="secure:password" value="" />
  <param name="submoduleCheckout" value="CHECKOUT" />
  <param name="teamcity:branchSpec"><![CDATA[+:foo
-:bar]]></param>
  <param name="url" value="git@github.com:brad-jones/teamcity-playground.git" />
  <param name="username" value="adsfghadfhsdfgjh" />
  <param name="usernameStyle" value="USERID" />
</vcs-root>

