<?xml version="1.0" encoding="UTF-8"?>
<build-type xmlns:xsi="http://www.w3.org/2001/XMLSchema-instance" uuid="f80e94c1-9ebe-4d82-8a23-0235d7db5e8f" xsi:noNamespaceSchemaLocation="https://www.jetbrains.com/teamcity/schemas/2020.1/project-config.xsd">
  <name>Package-Win</name>
  <description />
  <settings>
    <parameters />
    <build-runners>
      <runner id="RUNNER_6" name="" type="simpleRunner">
        <parameters>
          <param name="script.content" value="echo &quot;Hello World&quot;;" />
          <param name="teamcity.step.mode" value="default" />
          <param name="use.custom.script" value="true" />
        </parameters>
      </runner>
    </build-runners>
    <vcs-settings>
      <vcs-entry-ref root-id="Test1_GithubComBradJonesTeamcityPlayground" />
    </vcs-settings>
    <requirements />
    <build-triggers />
    <cleanup />
  </settings>
</build-type>

