<?xml version="1.0" encoding="UTF-8"?>
<vcs-root xmlns:xsi="http://www.w3.org/2001/XMLSchema-instance" uuid="03a4ac21-8dc7-4ec2-b4ad-5d74046c8379" type="jetbrains.git" xsi:noNamespaceSchemaLocation="https://www.jetbrains.com/teamcity/schemas/2020.1/project-config.xsd">
  <name>BarBaz</name>
  <param name="agentCleanFilesPolicy" value="ALL_UNTRACKED" />
  <param name="agentCleanPolicy" value="ON_BRANCH_CHANGE" />
  <param name="authMethod" value="ANONYMOUS" />
  <param name="branch" value="master" />
  <param name="ignoreKnownHosts" value="true" />
  <param name="submoduleCheckout" value="CHECKOUT" />
  <param name="url" value="https://github.com/brad-jones/teamcity-playground.git" />
  <param name="useAlternates" value="true" />
  <param name="usernameStyle" value="USERID" />
</vcs-root>

