<?xml version="1.0" encoding="UTF-8"?>
<build-type xmlns:xsi="http://www.w3.org/2001/XMLSchema-instance" uuid="f327b3b0-4272-4788-9772-5f210b0ff74b" xsi:noNamespaceSchemaLocation="https://www.jetbrains.com/teamcity/schemas/2020.1/project-config.xsd">
  <name>Package-Lin</name>
  <description />
  <settings>
    <parameters />
    <build-runners>
      <runner id="RUNNER_7" name="" type="simpleRunner">
        <parameters>
          <param name="script.content" value="echo &quot;Hello World&quot;;" />
          <param name="teamcity.step.mode" value="default" />
          <param name="use.custom.script" value="true" />
        </parameters>
      </runner>
    </build-runners>
    <vcs-settings>
      <vcs-entry-ref root-id="Test1_GithubComBradJonesTeamcityPlayground" />
    </vcs-settings>
    <requirements />
    <build-triggers>
      <build-trigger id="vcsTrigger" type="vcsTrigger">
        <parameters>
          <param name="branchFilter" value="+:*" />
          <param name="enableQueueOptimization" value="true" />
          <param name="quietPeriodMode" value="DO_NOT_USE" />
        </parameters>
      </build-trigger>
    </build-triggers>
    <dependencies>
      <depend-on sourceBuildTypeId="Test1_SubProject1_Test">
        <options>
          <option name="run-build-if-dependency-failed" value="RUN_ADD_PROBLEM" />
          <option name="take-started-build-with-same-revisions" value="true" />
          <option name="take-successful-builds-only" value="true" />
        </options>
      </depend-on>
    </dependencies>
    <cleanup />
  </settings>
</build-type>

