<?xml version="1.0" encoding="UTF-8"?>
<build-type xmlns:xsi="http://www.w3.org/2001/XMLSchema-instance" uuid="a314f3d4-8055-41cc-b2c6-e8802f4b5dc9" xsi:noNamespaceSchemaLocation="https://www.jetbrains.com/teamcity/schemas/2020.1/project-config.xsd">
  <name>Test</name>
  <description />
  <settings>
    <parameters />
    <build-runners />
    <vcs-settings>
      <vcs-entry-ref root-id="Test1_GithubComBradJonesTeamcityPlayground" />
    </vcs-settings>
    <requirements />
    <build-triggers />
    <cleanup />
  </settings>
</build-type>

