<?xml version="1.0" encoding="UTF-8"?>
<build-type xmlns:xsi="http://www.w3.org/2001/XMLSchema-instance" uuid="7d63c45e-300f-4cde-b3d4-6a87c15216c2" xsi:noNamespaceSchemaLocation="https://www.jetbrains.com/teamcity/schemas/2020.1/project-config.xsd">
  <name>Build1</name>
  <description>This is a build config</description>
  <settings>
    <options>
      <option name="allowExternalStatus" value="true" />
      <option name="allowPersonalBuildTriggering" value="false" />
      <option name="artifactRules" value="+:foo&#xA;+:./bar/xyz/*&#xA;+:baz" />
      <option name="branchFilter" value="+:master&#xD;&#xA;+:foo" />
      <option name="buildNumberPattern" value="1.%build.counter%-%build.vcs.number.VCSRootName%" />
      <option name="checkoutDirectory" value="/foo/bar/baz" />
      <option name="cleanBuild" value="true" />
      <option name="enableHangingBuildsDetection" value="false" />
      <option name="excludeDefaultBranchChanges" value="true" />
      <option name="showDependenciesChanges" value="true" />
    </options>
    <parameters />
    <build-runners />
    <vcs-settings>
      <vcs-entry-ref root-id="Test1_GithubComBradJonesTeamcityPlayground" />
    </vcs-settings>
    <requirements />
    <build-triggers />
    <cleanup />
  </settings>
</build-type>

