<?xml version="1.0" encoding="UTF-8"?>
<build-type xmlns:xsi="http://www.w3.org/2001/XMLSchema-instance" uuid="492ea0bb-e2b5-49fa-a55f-ae5a450377c8" xsi:noNamespaceSchemaLocation="https://www.jetbrains.com/teamcity/schemas/2020.1/project-config.xsd">
  <name>Build-Lin</name>
  <description />
  <settings>
    <options>
      <option name="buildNumberPattern" value="%build.counter%-foo" />
    </options>
    <parameters />
    <build-runners>
      <runner id="RUNNER_3" name="" type="simpleRunner">
        <parameters>
          <param name="script.content" value="echo &quot;Hello World&quot;;" />
          <param name="teamcity.step.mode" value="default" />
          <param name="use.custom.script" value="true" />
        </parameters>
      </runner>
    </build-runners>
    <vcs-settings>
      <vcs-entry-ref root-id="Test1_GithubComBradJonesTeamcityPlayground" />
    </vcs-settings>
    <requirements />
    <build-triggers />
    <cleanup />
  </settings>
</build-type>

