<?xml version="1.0" encoding="UTF-8"?>
<vcs-root xmlns:xsi="http://www.w3.org/2001/XMLSchema-instance" uuid="b389470e-fa99-49df-9c76-24408cda6c60" type="jetbrains.git" xsi:noNamespaceSchemaLocation="https://www.jetbrains.com/teamcity/schemas/2020.1/project-config.xsd">
  <name>github.com/brad-jones/teamcity-playground</name>
  <param name="agentCleanFilesPolicy" value="ALL_UNTRACKED" />
  <param name="agentCleanPolicy" value="ON_BRANCH_CHANGE" />
  <param name="authMethod" value="PASSWORD" />
  <param name="branch" value="refs/heads/master" />
  <param name="ignoreKnownHosts" value="true" />
  <param name="reportTagRevisions" value="true" />
  <param name="secure:password" value="credentialsJSON:39fd150f-810a-420f-831e-091bae70ae4a" />
  <param name="submoduleCheckout" value="CHECKOUT" />
  <param name="teamcity:branchSpec" value="+:refs/heads/*" />
  <param name="url" value="https://github.com/brad-jones/teamcity-playground.git" />
  <param name="useAlternates" value="true" />
  <param name="username" value="brad-jones" />
  <param name="usernameStyle" value="EMAIL" />
</vcs-root>

